{
  "schemaVersion": "2.0",
  "reviewedAt": "2026-09-06T14:48:44Z",
  "artifact": "artifacts/diagram.drawio.png",
  "sha256": "d473b938e1e251035c6597a4696195314fa175ed8f8f086d806d45ec797d0f63",
  "dimensions": {
    "width": 2602,
    "height": 1602
  },
  "automatedChecks": [
    {
      "name": "non-empty-artifact",
      "ok": true,
      "detail": "560900 bytes"
    },
    {
      "name": "minimum-readable-size",
      "ok": true,
      "detail": "2602x1602"
    },
    {
      "name": "aspect-ratio",
      "ok": true,
      "detail": "actual=1.624, expected=1.625"
    }
  ],
  "manualReview": {
    "status": "approved",
    "reviewer": "Codex visual inspection",
    "notes": "Inspected the final migrated render at original resolution. Semantic view intent metadata changed only; phase hierarchy, icon/text clearance, connector terminals, labels, badges, and reference composition remain visually clean. viewIntent=architecture.",
    "requiredCriteria": [
      "No clipped, overlapping, or unreadable text",
      "Connector direction and labels match the intended meaning",
      "Parallel connectors use independent lanes or one documented semantic bus",
      "Callouts mask only their own long rail and labels remain clear of badges",
      "Hierarchy, grouping, and visual balance are clear at target size",
      "Technology marks are exact, visible, and not misleading",
      "The composition looks intentional rather than template-filled"
    ]
  },
  "ok": true
}
