{
  "schemaVersion": "2.0",
  "reviewedAt": "2026-09-11T00:51:12Z",
  "artifact": "C:\\Users\\ADMIN\\Work\\GitTool\\nexcanvas-drawio\\benchmarks\\baselines\\sequence.png",
  "sha256": "9c0d996b59b0fd17cc4ec8661935a2862770fea14be22bdcf0cf5f82742d7c2b",
  "dimensions": {
    "width": 1877,
    "height": 1052
  },
  "automatedChecks": [
    {
      "name": "non-empty-artifact",
      "ok": true,
      "detail": "152873 bytes"
    },
    {
      "name": "minimum-readable-size",
      "ok": true,
      "detail": "1877x1052"
    }
  ],
  "manualReview": {
    "status": "approved",
    "reviewer": "Codex visual inspection",
    "notes": "Inspected at original resolution: participants follow request order, messages attach to lifelines without header tails, labels remain clear, and request/response direction is unambiguous.",
    "requiredCriteria": [
      "No clipped, overlapping, or unreadable text",
      "Connector direction and labels match the intended meaning",
      "Parallel connectors use independent lanes or one documented semantic bus",
      "Callouts mask only their own long rail and labels remain clear of badges",
      "Hierarchy, grouping, and visual balance are clear at target size",
      "Technology marks are exact, visible, and not misleading",
      "The composition looks intentional rather than template-filled"
    ]
  },
  "ok": true
}
