{
  "schemaVersion": "2.0",
  "reviewedAt": "2026-09-11T00:51:12Z",
  "artifact": "C:\\Users\\ADMIN\\Work\\GitTool\\nexcanvas-drawio\\benchmarks\\baselines\\data-flow.png",
  "sha256": "27367649aa2d35f93897a31054eb01473831843bc44f71c00ae1807141ea3f2e",
  "dimensions": {
    "width": 3127,
    "height": 602
  },
  "automatedChecks": [
    {
      "name": "non-empty-artifact",
      "ok": true,
      "detail": "193001 bytes"
    },
    {
      "name": "minimum-readable-size",
      "ok": true,
      "detail": "3127x602"
    }
  ],
  "manualReview": {
    "status": "approved",
    "reviewer": "Codex visual inspection",
    "notes": "Inspected at original resolution: phase groups are balanced, the left-to-right data path is unambiguous, labels remain inside clear connector gaps, and no text intersects a node or boundary.",
    "requiredCriteria": [
      "No clipped, overlapping, or unreadable text",
      "Connector direction and labels match the intended meaning",
      "Parallel connectors use independent lanes or one documented semantic bus",
      "Callouts mask only their own long rail and labels remain clear of badges",
      "Hierarchy, grouping, and visual balance are clear at target size",
      "Technology marks are exact, visible, and not misleading",
      "The composition looks intentional rather than template-filled"
    ]
  },
  "ok": true
}
