{
  "schemaVersion": "2.0",
  "reviewedAt": "2026-09-11T01:05:21Z",
  "artifact": "C:\\Users\\ADMIN\\Work\\GitTool\\nexcanvas-drawio\\benchmarks\\baselines\\lifecycle.png",
  "sha256": "db85e2701ff60385605999c4418ec9e3582f97d186887b24ac9dbf881096ef5b",
  "dimensions": {
    "width": 2277,
    "height": 1102
  },
  "automatedChecks": [
    {
      "name": "non-empty-artifact",
      "ok": true,
      "detail": "178333 bytes"
    },
    {
      "name": "minimum-readable-size",
      "ok": true,
      "detail": "2277x1102"
    }
  ],
  "manualReview": {
    "status": "approved",
    "reviewer": "Codex visual inspection",
    "notes": "Inspected at original resolution. State hierarchy, labeled transitions, retry path, approval loop, and terminal destinations are legible; connector endpoints are unambiguous and no text overlaps nodes or lines.",
    "requiredCriteria": [
      "No clipped, overlapping, or unreadable text",
      "Connector direction and labels match the intended meaning",
      "Parallel connectors use independent lanes or one documented semantic bus",
      "Callouts mask only their own long rail and labels remain clear of badges",
      "Hierarchy, grouping, and visual balance are clear at target size",
      "Technology marks are exact, visible, and not misleading",
      "The composition looks intentional rather than template-filled"
    ]
  },
  "ok": true
}
